,ticker,date,time,headline,neg,neu,pos,compound
0,AAPL,2020-09-27,10:35PM,Dow Jones Futures: Stock Market Rally Shows Bullish Action; How To Game Plan For A Key Week,0.0,1.0,0.0,0.0
1,AAPL,2020-09-27,02:30PM,Better Buy: Activision Blizzard vs. Apple,0.0,0.633,0.367,0.4404
2,AAPL,2020-09-27,10:08AM,What to Expect in the Markets This Week,0.0,1.0,0.0,0.0
3,AAPL,2020-09-27,08:45AM,This Apple Supplier Deserves to Be on Your Watchlist,0.0,1.0,0.0,0.0
4,AAPL,2020-09-26,01:00PM,"Dow Jones Stocks To Buy And Watch In September 2020: Amgen, Apple, Home Depot, Microsoft",0.0,1.0,0.0,0.0
5,AAPL,2020-09-26,01:00PM,Facebook Wants to Be Your Default iPhone Messaging Service,0.0,1.0,0.0,0.0
6,AAPL,2020-09-26,12:26PM,"This Week in Apps: Redesigning the iOS 14 home screen, app makers form 'fairness' coalition, latest on TikTok ban",0.167,0.833,0.0,-0.5574
7,AAPL,2020-09-26,10:49AM,TikTok Judge Schedules Sunday Hearing as Trumps Ban Looms,0.426,0.574,0.0,-0.6369
8,AAPL,2020-09-26,09:00AM,Oracle Buying TikTok and 15 More Strange  but Lucrative  Partnerships,0.147,0.853,0.0,-0.1397
9,AAPL,2020-09-26,08:51AM,How to get more iCloud storage,0.0,1.0,0.0,0.0
10,AAPL,2020-09-26,07:55AM,3 Cash-Cow Stocks to Buy Ahead of the Next Market Crash,0.231,0.769,0.0,-0.4019
11,AAPL,2020-09-26,04:21AM,Point/Counterpoint: The Case for Peloton,0.0,1.0,0.0,0.0
12,AAPL,2020-09-25,08:39PM,"As Zoom and Videoconferencing Boom, TVs Are Getting Left Behind",0.0,1.0,0.0,0.0
13,AAPL,2020-09-25,08:05PM,Why Rival Bike Peddlers Could Help Boost Pelotons Stock,0.0,0.565,0.435,0.6597
14,AAPL,2020-09-25,07:58PM,What Correction? S&P 500 Surges as Apple Leads Tech Stock Boom and Cruise Stocks Rise; Oil Stocks Fall,0.0,1.0,0.0,0.0
15,AAPL,2020-09-25,05:33PM,"Apple Gives In, Allows Facebook Pay for Paid Online Events",0.135,0.865,0.0,-0.1027
16,AAPL,2020-09-25,05:14PM,"Apple Decides to Waive 30% Cut of Paid Events on Facebook, but Only for 3 Months",0.1,0.9,0.0,-0.1406
17,AAPL,2020-09-25,04:42PM,Dow Jones Finishes Week With Strong Gains; This Leaderboard Stock Is In Buy Range,0.0,0.678,0.322,0.6908
18,AAPL,2020-09-25,04:37PM,Unity Stock Gets Its First Buy Rating From Wall Street,0.0,1.0,0.0,0.0
19,AAPL,2020-09-25,04:33PM,Stocks Stage Late Rally as Investors Look to Next Week,0.0,1.0,0.0,0.0
20,AAPL,2020-09-25,04:25PM,Apple Inc. stock outperforms competitors on strong trading day,0.0,0.708,0.292,0.5106
21,AAPL,2020-09-25,04:06PM,Apple Temporarily Stops Taking 30% Cut of Facebook Paid Events,0.316,0.684,0.0,-0.4019
22,AAPL,2020-09-25,03:03PM,"Boeing, Apple Inc. share gains contribute to Dow's 330-point rally",0.0,0.635,0.365,0.5574
23,AAPL,2020-09-25,02:31PM,Apple Watch reviews: The best features of the Series 6 and SE,0.0,0.704,0.296,0.6369
24,AAPL,2020-09-25,02:27PM,Apple Watch Series 6 review,0.0,1.0,0.0,0.0
25,AAPL,2020-09-25,02:03PM,"Dow's 214-point climb led by gains for Boeing, Apple Inc. shares",0.0,0.662,0.338,0.5574
26,AAPL,2020-09-25,01:50PM,Ex-Facebook and Pinterest exec explains how tech addiction made him rethink his life's work,0.0,1.0,0.0,0.0
27,AAPL,2020-09-25,01:39PM,"Nasdaq Soars 150 Points, Fueled By Big Gains For Tesla, Apple, Qualcomm; Boeing Leads Dow Jones",0.0,0.862,0.138,0.34
28,AAPL,2020-09-25,01:03PM,"Boeing, Apple Inc. share gains contribute to Dow's 133-point jump",0.0,0.635,0.365,0.5574
29,AAPL,2020-09-25,12:58PM,"Dow Jones Up 100 Points After Early Dive; Apple, Microsoft Lead Tech Stock Rally",0.0,1.0,0.0,0.0
30,AAPL,2020-09-25,12:53PM,"Buy Apple Stock Ahead of the iPhone 12 Launch, Morgan Stanley Says",0.0,1.0,0.0,0.0
31,AAPL,2020-09-25,12:40PM,Dow Jones Rallies as Apple Stock Touted by Analyst; Light at the End of the Tunnel for Boeing on the 737 MAX,0.054,0.946,0.0,-0.0516
32,AAPL,2020-09-25,12:09PM,"Dow Jones Erases Losses, As Apple, Tesla Jump; Novavax Surges 14% On Coronavirus Vaccine News",0.162,0.838,0.0,-0.4019
33,AAPL,2020-09-25,12:08PM,Facebook events service gets temporary exemption from Apple App Store fees: blog post,0.0,1.0,0.0,0.0
34,AAPL,2020-09-25,12:00PM,"Apple Temporarily Waives 30% Fee for Facebook Paid Live Events, but Not for Gaming Creators",0.0,1.0,0.0,0.0
35,AAPL,2020-09-25,12:00PM,Apple to Let Facebook Online Events Temporarily Avoid 30% Cut,0.35,0.65,0.0,-0.5106
36,AAPL,2020-09-25,12:00PM,Apple is (temporarily) waiving its App Store fee for Facebook's online events,0.0,1.0,0.0,0.0
37,AAPL,2020-09-25,12:00PM,Facebook events service gets temporary exemption from Apple App Store fees -blog post,0.0,1.0,0.0,0.0
38,AAPL,2020-09-25,10:47AM,"Boeing, Apple Inc. share gains contribute to Dow's 60-point jump",0.0,0.635,0.365,0.5574
39,AAPL,2020-09-25,09:45AM,Google to Increase Push for Apps to Give Cut of In-App Purchases,0.146,0.694,0.16,0.0516
40,AAPL,2020-09-25,09:38AM,Apple Shares Slip As EU Commission Appeals $15 Billion Tax Ruling,0.0,0.82,0.18,0.296
41,AAPL,2020-09-25,09:30AM,Is Qualcomm Stock a Buy?,0.0,1.0,0.0,0.0
42,AAPL,2020-09-25,08:50AM,Apple Stock Really Cant Go Much Higher. Buy These Tech Stocks Instead.,0.0,1.0,0.0,0.0
43,AAPL,2020-09-25,08:16AM,Dow Jones Futures Fall: Look For This Bullish Stock Market Signal; Tech Titans Hold Key Support,0.0,0.847,0.153,0.4019
44,AAPL,2020-09-25,06:00AM,The #MeToo movement blew up the way Hollywood operates: Jessica Alba,0.0,1.0,0.0,0.0
45,AAPL,2020-09-25,05:53AM,Apple says has always abided by Irish law as EU appeals court ruling,0.0,1.0,0.0,0.0
46,AAPL,2020-09-25,05:52AM,EU's Vestager appeals court veto of $15 billion Apple tax order,0.0,1.0,0.0,0.0
47,AAPL,2020-09-25,05:35AM,EU's Vestager appeals court ruling against $15 bln Apple tax order,0.0,1.0,0.0,0.0
48,AAPL,2020-09-25,04:47AM,Apple Dives Deeper In Podcast Game With Scout FM Acquisition,0.0,1.0,0.0,0.0
49,AAPL,2020-09-24,09:40PM,Apple critics form coalition to challenge App Store fees,0.21,0.667,0.124,-0.2263
50,AAPL,2020-09-24,09:10PM,"Apple: Favorable Mix Expected Ahead of iPhone 12 Launch, Says 5-Star Analyst",0.0,0.78,0.22,0.4767
51,AAPL,2020-09-24,07:40PM,"Amazon Chases Google, Microsoft in the Game-Streaming Market",0.0,0.805,0.195,0.1779
52,AAPL,2020-09-24,07:39PM,Election Chaos Might Be Looming. How to Invest Now.,0.426,0.574,0.0,-0.6369
53,AAPL,2020-09-24,06:48PM,Apple Buys Startup That Creates Radio-Like Stations for Podcasts,0.0,0.792,0.208,0.2732
54,AAPL,2020-09-24,06:39PM,Launch Center Pro lets you build custom icons to customize your iOS 14 home screen,0.0,1.0,0.0,0.0
55,AAPL,2020-09-24,05:33PM,Fitbit Sense review,0.0,1.0,0.0,0.0
56,AAPL,2020-09-24,04:36PM,PayPal and Square Could Gain as EU Mulls iPhone Payments Rules,0.0,0.746,0.254,0.5267
57,AAPL,2020-09-24,04:25PM,"Apple Inc. stock rises Thursday, outperforms market",0.0,1.0,0.0,0.0
58,AAPL,2020-09-24,04:22PM,Dow Jones Finishes Higher After Weak Jobless Claims Report As Tesla Shows This Bullish Chart Action,0.162,0.838,0.0,-0.4404
59,AAPL,2020-09-24,04:21PM,Tesla Stocks Stall Could Explain the Markets Downturn,0.205,0.795,0.0,-0.2023
60,AAPL,2020-09-24,04:03PM,"Spotify, Match Group, and Epic Games join forces to challenge Apple",0.0,0.72,0.28,0.3612
61,AAPL,2020-09-24,03:49PM,"Dow's nearly 50-point jump highlighted by gains in shares of Goldman Sachs, Apple Inc.",0.0,0.723,0.277,0.5574
62,AAPL,2020-09-24,03:10PM,The rotation to more value and cyclical sectors has already begun: Wealth Consulting Group CEO,0.0,0.688,0.312,0.7089
63,AAPL,2020-09-24,03:09PM,"Nasdaq Reverses Higher, Tesla Makes Bullish Move; Dow Jones Led By Goldman Sachs, Apple",0.0,1.0,0.0,0.0
64,AAPL,2020-09-24,02:49PM,"Dow's 129-point jump highlighted by gains for shares of Goldman Sachs, Coca-Cola",0.0,0.685,0.315,0.5574
65,AAPL,2020-09-24,02:44PM,"Why Fortnites Maker, Spotify, and Others Are Asking Apple to Change Its App Store",0.0,1.0,0.0,0.0
66,AAPL,2020-09-24,01:57PM,GRAPHIC-'Healthy correction' or something more? Stock swings keep investors on edge,0.0,1.0,0.0,0.0
67,AAPL,2020-09-24,01:49PM,"Goldman Sachs, Apple Inc. share gains lead Dow's 286-point rally",0.0,0.635,0.365,0.5574
68,AAPL,2020-09-24,01:35PM,Dow Jones Roars Back From Big Early Dive As Stocks Shrug Off Jobs Data,0.0,1.0,0.0,0.0
69,AAPL,2020-09-24,01:21PM,Buy the Dip in Apple? Here's the Trade,0.0,1.0,0.0,0.0
70,AAPL,2020-09-24,01:20PM,"Dow Jones Advances 250 Points, As Apple, Tesla Snap Back; Nikola Plummets 23% On Downgrade",0.0,1.0,0.0,0.0
71,AAPL,2020-09-24,01:14PM,"Spotify, Match Group form coalition to protest Apple's App Store policies",0.167,0.833,0.0,-0.25
72,AAPL,2020-09-24,01:12PM,Amazon adds to its lineup of voice-controlled gadgets,0.0,0.805,0.195,0.1779
73,AAPL,2020-09-24,01:12PM,TikTok Judge Tells U.S. to Delay Ban or Argue for It Friday,0.48,0.52,0.0,-0.8074
74,AAPL,2020-09-24,01:02PM,US STOCKS-Tech stocks lift Wall Street as economic rebound slows,0.0,1.0,0.0,0.0
75,AAPL,2020-09-24,12:49PM,"Dow jumps 100 points on gains in Goldman Sachs, Apple Inc. stocks",0.0,0.821,0.179,0.34
76,AAPL,2020-09-24,11:53AM,Tech Support: Optimizing Your iCloud Storage,0.0,0.412,0.588,0.6908
77,AAPL,2020-09-24,11:46AM,Record Canada Tech IPO Rewards CEO Who Shunned a Sale to Rival,0.0,0.763,0.237,0.4767
78,AAPL,2020-09-24,11:46AM,"Goldman Sachs, Apple Inc. share gains lead Dow's 30-point jump",0.0,0.635,0.365,0.5574
79,AAPL,2020-09-24,11:44AM,US STOCKS-Nasdaq rises on tech boost as economic recovery cools,0.0,0.769,0.231,0.4019
80,AAPL,2020-09-24,11:39AM,What a Biden presidency would mean for tech stocks,0.0,1.0,0.0,0.0
81,AAPL,2020-09-24,10:57AM,"Spotify, Hollywood producer Chernin to adapt podcast shows for films, TV",0.0,1.0,0.0,0.0
82,AAPL,2020-09-24,10:46AM,"Spotify, Match Join a Challenge to Apple's App Store Practices",0.0,0.667,0.333,0.3612
83,AAPL,2020-09-24,10:25AM,US STOCKS-Nasdaq rises on tech boost as economic recovery cools,0.0,0.769,0.231,0.4019
84,AAPL,2020-09-24,10:00AM,Is the Market Crashing? 4 Stocks You Can Buy Right Now,0.0,1.0,0.0,0.0
85,AAPL,2020-09-24,08:59AM,US STOCKS-Wall Street set to open lower as labor market recovery cools,0.167,0.833,0.0,-0.296
86,AAPL,2020-09-24,08:21AM,Dow Jones Futures: Stock Market Sells Off Bearishly; Tesla Extends Battery Day Dive,0.0,0.889,0.111,0.128
87,AAPL,2020-09-24,08:02AM,Apple critics form coalition to challenge App Store fees,0.21,0.667,0.124,-0.2263
88,AAPL,2020-09-24,08:00AM,Apples App Store Isnt Evil,0.0,0.532,0.468,0.5448
89,AAPL,2020-09-24,06:06AM,The FAANG Stock News You Completely Missed Last Month,0.238,0.762,0.0,-0.3597
90,AAPL,2020-09-24,04:02AM,'We're a tech company': Russia's Sberbank bets big on strategy shift,0.0,1.0,0.0,0.0
91,AAPL,2020-09-24,03:59AM,FOCUS-'We're a tech company': Russia's Sberbank bets big on strategy shift,0.0,1.0,0.0,0.0
92,AAPL,2020-09-24,01:06AM,"Caught in China-US trade war, Taiwan offers support to chipmakers",0.267,0.548,0.185,-0.296
93,AAPL,2020-09-23,07:01PM,COVID-19 smartphone app finally launches in England and Wales,0.0,1.0,0.0,0.0
94,AAPL,2020-09-23,06:24PM,Why Apple Stock Fell Today,0.0,1.0,0.0,0.0
95,AAPL,2020-09-23,06:24PM,Barr Remains Wary of Security Concerns in Oracles TikTok Deal,0.0,0.789,0.211,0.34
96,AAPL,2020-09-23,04:36PM,US STOCKS-Wall Street closes lower on fears of a slowing economy,0.385,0.615,0.0,-0.6124
97,AAPL,2020-09-23,04:25PM,Apple Inc. stock underperforms Wednesday when compared to competitors,0.0,1.0,0.0,0.0
98,AAPL,2020-09-23,04:16PM,Apple Stock Downgraded On Mature Hardware Businesses,0.0,0.682,0.318,0.4215
99,AAPL,2020-09-23,04:01PM,US STOCKS-Wall Street closes lower on fears of a slowing economy,0.385,0.615,0.0,-0.6124
