,ticker,date,time,headline,neg,neu,pos,compound
0,COP,2020-09-25,09:38AM,"Benzinga's Top Upgrades, Downgrades For September 25, 2020",0.0,0.795,0.205,0.2023
1,COP,2020-09-25,02:05AM,ConocoPhillips Forecasts a Recovery in Global Oil Demand; Stock Price Target $51,0.13,0.87,0.0,-0.128
2,COP,2020-09-22,10:27AM,Why Investors are Holding ConocoPhillips (COP) Stock Now,0.0,1.0,0.0,0.0
3,COP,2020-09-21,07:58AM,What to Expect in the Markets This Week,0.0,1.0,0.0,0.0
4,COP,2020-09-19,10:12AM,How Much Does ConocoPhillips' (NYSE:COP) CEO Make?,0.0,1.0,0.0,0.0
5,COP,2020-09-17,12:00PM,"ConocoPhillips to Hold Third-Quarter Earnings Conference Call on Thursday, Oct. 29",0.0,1.0,0.0,0.0
6,COP,2020-09-16,09:52AM,U.S. CEO group says it supports carbon pricing to fight climate change,0.172,0.662,0.166,-0.0258
7,COP,2020-09-14,06:06PM,WFRBS Commercial Mortgage Trust 2014-C24 -- Moody's affirms ten and downgrades two classes of WFRBS 2014-C24,0.0,0.82,0.18,0.5106
8,COP,2020-09-14,11:42AM,ConocoPhillips Expands North Sea Deal With Aker Solutions,0.0,0.659,0.341,0.2732
9,COP,2020-09-11,05:38PM,Louisiana Land & Exploration Company -- Moody's announces completion of a periodic review of ratings of ConocoPhillips,0.0,0.881,0.119,0.2263
10,COP,2020-09-11,09:29AM,Aker Solutions Bags North Sea Conoco Deal,0.0,0.779,0.221,0.1779
11,COP,2020-09-10,10:11AM,ConocoPhillips Adds Goldman Sachs Alum to Board,0.0,1.0,0.0,0.0
12,COP,2020-09-08,03:59PM,Why ConocoPhillips Stock Fell During Today's Brutal Oil Crash,0.493,0.507,0.0,-0.7783
13,COP,2020-09-08,09:27AM,Hedge Funds Arent Done Selling ConocoPhillips (COP),0.0,1.0,0.0,0.0
14,COP,2020-09-08,09:00AM,ConocoPhillips Appoints Eric Mullins to its Board of Directors,0.0,1.0,0.0,0.0
15,COP,2020-09-07,11:10AM,ConocoPhillips Draws Application for Flaring Permit Extension,0.0,1.0,0.0,0.0
16,COP,2020-09-04,03:37PM,REFILE-ConocoPhillips pulls request for extension of flaring permits at 41 Texas sites,0.0,1.0,0.0,0.0
17,COP,2020-09-04,12:27PM,5 Energy Stocks to Consider as Oil Prices Struggle to Recover,0.185,0.645,0.169,-0.0516
18,COP,2020-09-02,07:12PM,Analyst Report: ConocoPhillips,0.0,1.0,0.0,0.0
19,COP,2020-09-02,09:56AM,4 US Integrated Oil Stocks to Escape Industry Woes Amid Coronavirus,0.23,0.635,0.135,-0.296
20,COP,2020-08-29,11:31AM,Why Is ConocoPhillips (COP) Up 2% Since Last Earnings Report?,0.0,1.0,0.0,0.0
21,COP,2020-08-26,03:25PM,Top Energy Stocks for September 2020,0.0,0.506,0.494,0.4404
22,COP,2020-08-24,10:02AM,ConocoPhillips Completes $390 Million Montney Acquisition,0.0,1.0,0.0,0.0
23,COP,2020-08-24,09:00AM,Will ConocoPhillips' (NYSE:COP) Growth In ROCE Persist?,0.0,0.698,0.302,0.3818
24,COP,2020-08-21,02:30PM,ConocoPhillips Completes Previously Announced Montney Acquisition,0.0,1.0,0.0,0.0
25,COP,2020-08-18,03:18PM,"The State of the Oil Industry, Part 3",0.0,1.0,0.0,0.0
26,COP,2020-08-17,02:09PM,Trump Plans Arctic Drilling Rights Sale in Likely 2020 Clash,0.0,1.0,0.0,0.0
27,COP,2020-08-17,10:10AM,Trump Administration to Approve Oil Drilling in Alaskan Refuge,0.0,1.0,0.0,0.0
28,COP,2020-08-16,03:12AM,ConocoPhillips Snags Approval For Major Alaska Oil Project,0.0,0.693,0.307,0.4767
29,COP,2020-08-15,07:00PM,U.S. Oil Drillers Look To Restart Shut-In Production This Year,0.0,1.0,0.0,0.0
30,COP,2020-08-13,01:18PM,5 Oil and Gas Stocks on the Receiving End of Big Short Bets,0.0,1.0,0.0,0.0
31,COP,2020-08-12,07:30AM,U.S. Futures Rise With Bond Yields; Gold Rebounds: Markets Wrap,0.0,1.0,0.0,0.0
32,COP,2020-08-10,08:15AM,Canadian Natural buys Painted Pony for $344 mln to boost Western Canada acreage,0.0,0.679,0.321,0.6369
33,COP,2020-08-05,11:45AM,Why ConocoPhillips Stock Slumped 11% in July,0.0,1.0,0.0,0.0
34,COP,2020-07-31,12:34PM,"Oil Ends July Slightly up, With Foreboding Shadow of OPEC Supply",0.0,1.0,0.0,0.0
35,COP,2020-07-31,10:37AM,Is Weakness In ConocoPhillips (NYSE:COP) Stock A Sign That The Market Could be Wrong Given Its Strong Financial Prospects?,0.232,0.551,0.217,-0.1027
36,COP,2020-07-31,01:01AM,ConocoPhillips (COP) Q2 2020 Earnings Call Transcript,0.0,1.0,0.0,0.0
37,COP,2020-07-30,05:56PM,US Indexes Close Mostly Lower Thursday After GDP Report,0.216,0.784,0.0,-0.296
38,COP,2020-07-30,03:41PM,Oil Slides Most in a Month on Grim Economic Signals,0.316,0.684,0.0,-0.5719
39,COP,2020-07-30,03:15PM,ConocoPhillips (COP) Q2 Earnings Miss on Low Crude Prices,0.552,0.448,0.0,-0.7506
40,COP,2020-07-30,02:40PM,ConocoPhillips Earnings Lag Expectations on Weak Oil Market,0.469,0.531,0.0,-0.6486
41,COP,2020-07-30,12:28PM,Total and Apache Stocks: 2 Winners From Otherwise Dismal Oil Earnings,0.265,0.53,0.205,-0.2263
42,COP,2020-07-30,12:11PM,ConocoPhillips' Earnings Tumble Along With Oil Prices,0.0,1.0,0.0,0.0
43,COP,2020-07-30,09:31AM,How Does ConocoPhillips's Debt Look Like?,0.278,0.444,0.278,0.0
44,COP,2020-07-30,09:05AM,"ConocoPhillips (COP) Reports Q2 Loss, Misses Revenue Estimates",0.412,0.588,0.0,-0.4939
45,COP,2020-07-30,07:39AM,"ConcoPhillips posts wider-than-expected adjusted loss as weak oil price, slack demand during pandemic weigh",0.379,0.621,0.0,-0.6908
46,COP,2020-07-30,07:23AM,ConocoPhillips to reverse most output cuts by end of third quarter,0.199,0.801,0.0,-0.3566
47,COP,2020-07-30,07:00AM,ConocoPhillips Reports Second-Quarter 2020 Results,0.0,1.0,0.0,0.0
48,COP,2020-07-30,04:04AM,"Stocks - Qualcomm, PayPal Rise Premarket; ConocoPhillips Falls",0.0,1.0,0.0,0.0
49,COP,2020-07-29,09:17AM,3 Top Oil Stocks to Buy in August,0.0,0.769,0.231,0.2023
50,COP,2020-07-29,08:32AM,Is a Surprise Coming for ConocoPhilips (COP) This Earnings Season?,0.0,0.792,0.208,0.2732
51,COP,2020-07-28,05:00AM,Socially Conscious Investing Thrives Amid Pandemic,0.0,1.0,0.0,0.0
52,COP,2020-07-27,11:57AM,Is a Beat in Store for ConocoPhillips' (COP) Q2 Earnings?,0.0,1.0,0.0,0.0
53,COP,2020-07-25,10:41AM,"SunTrust Likes Chevron, ConocoPhillips, Neutral On Exxon",0.0,0.682,0.318,0.4215
54,COP,2020-07-23,12:33PM,Earnings Preview: ConocoPhillips (COP) Q2 Earnings Expected to Decline,0.0,1.0,0.0,0.0
55,COP,2020-07-23,09:54AM,ConocoPhillips Boosts Montney Footprint With $375M Acquisition,0.0,0.723,0.277,0.3182
56,COP,2020-07-22,05:37PM,U.S. oil major ConocoPhillips buys Canadian land from Kelt in $375 million deal,0.0,1.0,0.0,0.0
57,COP,2020-07-22,04:30PM,ConocoPhillips Announces Agreement to Acquire Liquids-Rich Montney Acreage from Kelt Exploration Ltd.,0.0,0.662,0.338,0.6249
58,COP,2020-07-17,03:32PM,U.S. Oil Companies Are Drilling Again. Heres Whos Ramping Up.,0.0,1.0,0.0,0.0
59,COP,2020-07-16,04:32PM,Individual Investors Stick With Stocks Amid Rising Anxiety,0.195,0.805,0.0,-0.1779
60,COP,2020-07-14,01:13PM,5 Energy Companies to Consider as New Coronavirus Cases Cause Concern,0.0,0.811,0.189,0.2732
61,COP,2020-07-10,08:53AM,Why ConocoPhillips Stock Plummeted in the First Half of 2020,0.0,1.0,0.0,0.0
62,COP,2020-07-08,12:58PM,ConocoPhillips Announces Quarterly Dividend of 42 Cents Per Share,0.0,0.784,0.216,0.296
63,COP,2020-07-07,03:16PM,Were Hedge Funds Right About Piling Into ConocoPhillips (COP)?,0.0,1.0,0.0,0.0
64,COP,2020-07-07,10:51AM,Here's Why You Should Buy ConocoPhillips Stock Right Now,0.0,1.0,0.0,0.0
65,COP,2020-07-06,12:42PM,Is ConocoPhillips (NYSE:COP) Expensive For A Reason? A Look At Its Intrinsic Value,0.0,0.806,0.194,0.34
66,COP,2020-07-05,03:24PM,"Forget Occidental Petroleum, ConocoPhillips Is a Better Oil Producer Stock to Buy Right Now",0.12,0.696,0.184,0.25
67,COP,2020-07-02,06:24PM,US Indexes Close Higher to End the Shortened Week,0.0,1.0,0.0,0.0
68,COP,2020-07-02,11:25AM,ConocoPhillips Taps Low-Code Software to Help It Adapt to the Times,0.0,0.787,0.213,0.4019
69,COP,2020-07-01,10:18AM,"Sell Exxon Stock Ahead of Earnings, Buy Chevron ConocoPhillips, Says Goldman",0.0,1.0,0.0,0.0
70,COP,2020-07-01,09:19AM,"ConocoPhillips to Revive Output, Expects Q2 Profit to Fall Y/Y",0.0,0.602,0.398,0.6486
71,COP,2020-06-30,07:55PM,"Oil Price Fundamental Daily Forecast  After Big API Draw, Bulls Hoping for Surprise in EIA Report",0.0,0.741,0.259,0.5994
72,COP,2020-06-30,05:09PM,Crude Posts Best Quarter Since 1990 After Historic Price Crash,0.364,0.398,0.239,-0.296
73,COP,2020-06-30,10:28AM,ConocoPhillips to bring back some curtailed production,0.0,1.0,0.0,0.0
74,COP,2020-06-30,10:16AM,ConocoPhillips Plans to Restart Production in Alaska in July,0.0,1.0,0.0,0.0
75,COP,2020-06-30,08:54AM,ConocoPhillips to restore curtailed production in Alaska in July,0.0,0.784,0.216,0.296
76,COP,2020-06-30,08:30AM,ConocoPhillips Provides Update on Production Curtailment Activities,0.0,1.0,0.0,0.0
77,COP,2020-06-30,07:00AM,Oil major ConocoPhillips deploys low-code tech to boost bottom line,0.0,0.769,0.231,0.4019
78,COP,2020-06-29,04:53PM,"U.S. Cases Rise 1.2%; Worst Yet to Come, WHO Says: Virus Update",0.272,0.728,0.0,-0.6249
79,COP,2020-06-23,09:07PM,Australia's FAR says Senegalese unit in default over Sangomar project,0.0,1.0,0.0,0.0
80,COP,2020-06-23,06:00AM,5 Oil & Gas Stocks That Have Shown They Can Grow Safely,0.0,0.738,0.262,0.4939
81,COP,2020-06-17,10:50AM,Oil Limits Losses with Inventory Drop at Key U.S. Storage Site,0.348,0.652,0.0,-0.5859
82,COP,2020-06-17,08:39AM,ConocoPhillips to Restart Normal Upstream Activities in Alaska,0.0,1.0,0.0,0.0
83,COP,2020-06-16,09:21AM,"Oil & Gas Stock Roundup: BP's $17.5B Writedown, ConocoPhillips' Production Plans & More",0.0,1.0,0.0,0.0
84,COP,2020-06-15,07:45AM,BP Submits to Brutal Reality on the Future of Oil,0.313,0.687,0.0,-0.6249
85,COP,2020-06-10,09:32AM,Here's Why ConocoPhillips is Planning to Raise Production,0.0,1.0,0.0,0.0
86,COP,2020-06-09,04:09PM,"ConocoPhillips to Hold Second-Quarter Earnings Conference Call on Thursday, July 30",0.0,1.0,0.0,0.0
87,COP,2020-06-09,11:00AM,OFFICIAL CORRECTION: ConocoPhillips CEO says Chinese protocols helped it through coronavirus pandemic,0.0,1.0,0.0,0.0
88,COP,2020-06-08,03:44PM,6 Energy Stocks Trading With Low Price-Sales Ratios,0.228,0.543,0.228,0.0
89,COP,2020-06-08,11:13AM,The 3 Safest Oil Dividends Right Now,0.0,0.649,0.351,0.4019
90,COP,2020-06-08,09:59AM,Sirius XM Radio Inc. -- Moody's assigns Ba3 rating to Sirius XM Radio's new senior unsecured notes,0.14,0.86,0.0,-0.3818
91,COP,2020-06-05,06:09PM,US Indexes Gain Friday After Jobs Report,0.0,0.638,0.362,0.5267
92,COP,2020-06-04,05:00PM,3 Ways To Play The Oil Price Bounce,0.0,0.714,0.286,0.34
93,COP,2020-06-04,08:22AM,3 Top Oil Stocks to Buy in June,0.0,0.769,0.231,0.2023
94,COP,2020-06-02,07:42AM,"Oil & Gas Stock Roundup: Occidental's 2nd Dividend Cut, Williams' Solar Push & More",0.16,0.84,0.0,-0.2732
95,COP,2020-06-01,05:51PM,US Indexes Start the Month of June Slightly Higher,0.0,1.0,0.0,0.0
96,COP,2020-05-30,11:31AM,ConocoPhillips (COP) Up 0.2% Since Last Earnings Report: Can It Continue?,0.0,1.0,0.0,0.0
97,COP,2020-05-29,12:06PM,Climate Crusaders vs. Big Oil: Who Will Win the Legal Row?,0.0,0.629,0.371,0.6486
98,COP,2020-05-29,09:54AM,ConocoPhillips Closes Australian Asset Divestment to Santos,0.0,0.706,0.294,0.3612
99,COP,2020-05-27,09:56PM,ConocoPhillips Completes Sale of Interests in Australia-West,0.0,0.75,0.25,0.25
