,ticker,date,time,headline,neg,neu,pos,compound
0,AMZN,2020-09-23,08:31PM,Dow Jones Futures Fall After Stock Market Sells Off Bearishly; Tesla Extends Battery Day Dive,0.0,0.903,0.097,0.128
1,AMZN,2020-09-23,06:34PM,"September Sell-Off: S&P 500 Craters 78 Points, Approaching Correction Levels as Apple, Oxy, Lead Tech Stocks, Energy Stocks Down",0.0,0.896,0.104,0.2732
2,AMZN,2020-09-23,05:16PM,Amazon Prime Day Begins Oct. 13: Report,0.0,0.779,0.221,0.1779
3,AMZN,2020-09-23,04:36PM,US STOCKS-Wall Street closes lower on fears of a slowing economy,0.385,0.615,0.0,-0.6124
4,AMZN,2020-09-23,04:25PM,"Netflix Inc. stock falls Wednesday, underperforms market",0.0,1.0,0.0,0.0
5,AMZN,2020-09-23,04:25PM,"Amazon.com Inc. stock falls Wednesday, underperforms market",0.0,1.0,0.0,0.0
6,AMZN,2020-09-23,04:25PM,3M Co. stock outperforms market despite losses on the day,0.0,0.799,0.201,0.3089
7,AMZN,2020-09-23,04:01PM,Peloton Stock Rises As Amazon Denies Echelon Bike Ties,0.243,0.609,0.148,-0.2732
8,AMZN,2020-09-23,04:01PM,US STOCKS-Wall Street closes lower on fears of a slowing economy,0.385,0.615,0.0,-0.6124
9,AMZN,2020-09-23,03:41PM,Amazon denies connection to Echelon Fitness Prime Bike,0.241,0.431,0.328,0.0
10,AMZN,2020-09-23,02:52PM,"US STOCKS-Wall Street retreats as business activity slows, raising fears over economy",0.203,0.797,0.0,-0.4215
11,AMZN,2020-09-23,01:28PM,7 of the biggest reasons why the stock market is having a dreadful September,0.209,0.791,0.0,-0.4404
12,AMZN,2020-09-23,01:28PM,Don't Sweat the Prime Bike Snafu: These 2 Other Recent Amazon Announcements Are Much Bigger Deals,0.192,0.714,0.093,-0.4215
13,AMZN,2020-09-23,01:15PM,Amazon tells Echelon to stop selling Prime Bike,0.222,0.606,0.172,-0.128
14,AMZN,2020-09-23,01:14PM,US STOCKS-Wall Street retreats as business activity slows,0.0,1.0,0.0,0.0
15,AMZN,2020-09-23,12:32PM,Why a president Joe Biden might be great for Tesla stock: analyst,0.0,0.709,0.291,0.6249
16,AMZN,2020-09-23,12:30PM,Where Will Amazon Be in 10 Years?,0.0,0.779,0.221,0.1779
17,AMZN,2020-09-23,12:29PM,Top Strategists on Where to Invest Now,0.0,0.769,0.231,0.2023
18,AMZN,2020-09-23,12:17PM,The Biggest Retail Takeovers and Mergers of the 2000s and 2010s,0.0,1.0,0.0,0.0
19,AMZN,2020-09-23,12:02PM,Peloton Shares Rebound After Amazon Denies Echelon Partnership,0.239,0.427,0.333,0.0258
20,AMZN,2020-09-23,11:58AM,US STOCKS-Wall Street retreats as business activity slows,0.0,1.0,0.0,0.0
21,AMZN,2020-09-23,11:37AM,Google Antitrust Lawsuit to Narrowly Focus on Search Dominance,0.178,0.654,0.168,-0.0258
22,AMZN,2020-09-23,11:25AM,Is Target Stock a Buy?,0.0,1.0,0.0,0.0
23,AMZN,2020-09-23,11:21AM,"Amazon (AMZN) Has Risen 80% in Last One Year, Outperforms Market",0.0,0.855,0.145,0.1779
24,AMZN,2020-09-23,11:03AM,Amazon Prime Day: You Only Have a Few Weeks to Prepare,0.0,0.841,0.159,0.1779
25,AMZN,2020-09-23,10:44AM,Peloton Rebounds as Amazon Debunks $499 'Prime Bike' Offering,0.0,0.825,0.175,0.1779
26,AMZN,2020-09-23,10:30AM,WhyLabs brings more transparancy to ML ops,0.0,1.0,0.0,0.0
27,AMZN,2020-09-23,10:19AM,"US STOCKS-S&P 500, Nasdaq retreat as business activity dips",0.0,0.816,0.184,0.2023
28,AMZN,2020-09-23,09:18AM,"Amazon Disavows Prime Bike, Says It Had Nothing to Do With It",0.0,0.866,0.134,0.1779
29,AMZN,2020-09-23,09:02AM,Honest Company Founder Jessica Alba: Ethics shouldnt be a marketing ploy,0.0,0.732,0.268,0.5106
30,AMZN,2020-09-23,09:00AM,"Peloton Will Now Have to Compete With Amazon, Too",0.0,0.825,0.175,0.1779
31,AMZN,2020-09-23,08:31AM,"US STOCKS-Nike set to lift S&P 500, Dow ahead of business activity data",0.0,1.0,0.0,0.0
32,AMZN,2020-09-23,08:30AM,Its Not Too Late to Profit on FedEx Stocks Big Swing. Heres How With Options.,0.0,0.828,0.172,0.4404
33,AMZN,2020-09-23,08:17AM,Amazon Says Its Not Making the $500 Prime Bike With Echelon,0.0,0.855,0.145,0.1779
34,AMZN,2020-09-23,08:14AM,"Amazon removes the $500 Prime Bike, says it has nothing to do with the Peloton knock-off",0.0,0.898,0.102,0.1779
35,AMZN,2020-09-23,08:13AM,Dow Jones Futures Jump 200 Points As Nike Soars 13% On Earnings; Tesla Dives On Battery Day,0.0,1.0,0.0,0.0
36,AMZN,2020-09-23,08:07AM,GLOBAL MARKETS-Tech lifts stocks as poor data rekindles stimulus hopes,0.223,0.576,0.201,-0.0772
37,AMZN,2020-09-23,07:58AM,Reports say Amazon Prime Day will take place on Oct. 13 though the e-commerce giant hasn't confirmed,0.0,0.904,0.096,0.1779
38,AMZN,2020-09-23,07:49AM,Better Buy: Beyond Meat vs. Walmart,0.0,0.633,0.367,0.4404
39,AMZN,2020-09-23,07:07AM,A Deep Dive Into JFrog -- the Tech Company Keeping Your Software Updated,0.0,1.0,0.0,0.0
40,AMZN,2020-09-23,07:00AM,5 Things to Know About Palantir's Upcoming IPO,0.0,1.0,0.0,0.0
41,AMZN,2020-09-23,06:54AM,US STOCKS-Futures rise ahead of business activity data; Nike shines,0.0,1.0,0.0,0.0
42,AMZN,2020-09-23,06:51AM,3 Stocks That Could Make You Rich,0.0,0.581,0.419,0.5574
43,AMZN,2020-09-23,06:13AM,Lion Electric to deliver 10 battery electric trucks to Amazon,0.0,0.841,0.159,0.1779
44,AMZN,2020-09-23,04:53AM,GLOBAL MARKETS-Tech lifts world stocks as economy back in focus,0.0,1.0,0.0,0.0
45,AMZN,2020-09-23,03:22AM,"Not All FAANG Stocks Are Going To Be Winners, Munster Says",0.0,0.763,0.237,0.4767
46,AMZN,2020-09-23,02:19AM,Amazon launches climate-friendly program to help shop for sustainable products,0.0,0.645,0.355,0.5267
47,AMZN,2020-09-23,02:12AM,Amazon launches climate-friendly program to help shop for sustainable products,0.0,0.645,0.355,0.5267
48,AMZN,2020-09-23,02:00AM,Amazon launches climate-friendly program to help shop for sustainable products,0.0,0.645,0.355,0.5267
49,AMZN,2020-09-23,12:02AM,"Walmart ramps up hiring spree ahead of holidays, set to hire 20,000 seasonal workers",0.0,0.833,0.167,0.3818
50,AMZN,2020-09-22,11:34PM,Amazon Tells Echelon Fitness to Stop Selling $500 Prime Bike,0.169,0.538,0.292,0.1531
51,AMZN,2020-09-22,11:08PM,"GLOBAL MARKETS-Asian stocks struggle to build on Wall Street gains, dollar rises",0.156,0.68,0.163,0.0258
52,AMZN,2020-09-22,09:51PM,Microsoft and AT&T Try to Make the Internet of Things Easier,0.0,0.781,0.219,0.4215
53,AMZN,2020-09-22,09:24PM,"Australia shares jump 1.3% on Wall Street rebound, easing border curbs",0.0,0.682,0.318,0.4939
54,AMZN,2020-09-22,08:20PM,A $50 Phone is Ambani's Weapon to Dominate India Telecom Market,0.316,0.684,0.0,-0.4019
55,AMZN,2020-09-22,07:57PM,GLOBAL MARKETS-Asian stocks set to gain after Wall Street's tech bounce,0.0,0.746,0.254,0.5267
56,AMZN,2020-09-22,07:24PM,GameStop Rises Sharply on Disclosure of Talks With Activist Investor,0.0,1.0,0.0,0.0
57,AMZN,2020-09-22,07:01PM,Jim Cramer: Predict the Country's Future Now? Look at What We've Read and Seen,0.0,1.0,0.0,0.0
58,AMZN,2020-09-22,06:55PM,Microsoft Guns for Twilio's Business With Launch of Azure Communication Services,0.0,1.0,0.0,0.0
59,AMZN,2020-09-22,06:21PM,"S&P 500 Bounces Back as Twitter, Amazon, Homebuilder Stocks Move Higher",0.0,0.855,0.145,0.1779
60,AMZN,2020-09-22,05:23PM,Stock Markets Rebound as Amazon Chases Peloton; High Hopes for Aurora Cannabis,0.0,0.69,0.31,0.5423
61,AMZN,2020-09-22,05:19PM,'The stocks in the S&P 500 are not necessarily reflective of the full economy': Strategist,0.0,1.0,0.0,0.0
62,AMZN,2020-09-22,05:14PM,"Nasdaq Jumps 180 Points, Led By Amazon, Lululemon; Tesla Slumps Ahead Of Battery Day",0.0,0.884,0.116,0.1779
63,AMZN,2020-09-22,04:58PM,"Stock Market Rally Finally Gets A Win; Amazon, Target, Snap In Focus",0.0,0.621,0.379,0.6705
64,AMZN,2020-09-22,04:43PM,GLOBAL MARKETS-Dollar rises on hawkish comments; stocks end up,0.0,1.0,0.0,0.0
65,AMZN,2020-09-22,04:25PM,"Netflix Inc. stock rises Tuesday, still underperforms market",0.0,1.0,0.0,0.0
66,AMZN,2020-09-22,04:25PM,"Amazon.com Inc. stock rises Tuesday, outperforms market",0.0,1.0,0.0,0.0
67,AMZN,2020-09-22,04:25PM,"3M Co. stock rises Tuesday, still underperforms market",0.0,1.0,0.0,0.0
68,AMZN,2020-09-22,04:24PM,"US STOCKS-Wall Street closes higher on Amazon boost, despite economic worries",0.0,0.543,0.457,0.6939
69,AMZN,2020-09-22,04:20PM,"After A Long Delay, Is Amazon Prime Day Coming In October?",0.192,0.667,0.142,-0.1531
70,AMZN,2020-09-22,04:17PM,Exclusive Interview: The Motley Fool Sits Down With Nano-X Imaging,0.234,0.645,0.121,-0.34
71,AMZN,2020-09-22,04:00PM,"US STOCKS-Wall Street closes higher on Amazon boost, despite economic worries",0.0,0.543,0.457,0.6939
72,AMZN,2020-09-22,03:53PM,How Tesla stacks up against other tech juggernauts at similar stages  theres good news and bad news,0.164,0.701,0.136,-0.1531
73,AMZN,2020-09-22,03:52PM,A Net-Zero Portfolio Is a Pipe Dream. Heres What Investors Can Do Instead to Fight Climate Change.,0.148,0.739,0.114,-0.1531
74,AMZN,2020-09-22,03:46PM,Why Amazon Is Jumping Higher Today,0.0,0.746,0.254,0.1779
75,AMZN,2020-09-22,03:25PM,"Mnuchin, Powell promise action to aid economic recovery",0.0,0.753,0.247,0.3182
76,AMZN,2020-09-22,03:11PM,Amazon Restricts Ads for Competing Electronic Devices,0.256,0.556,0.189,-0.1531
77,AMZN,2020-09-22,03:05PM,Top 20 Richest People In The World,0.0,0.49,0.51,0.6369
78,AMZN,2020-09-22,03:00PM,Amazon slammed in report for adding largely low-quality' jobs amid coronavirus,0.0,0.855,0.145,0.1779
79,AMZN,2020-09-22,02:56PM,"US STOCKS-Wall Street gains on Amazon boost, despite worries over economy",0.0,0.434,0.566,0.7982
80,AMZN,2020-09-22,01:57PM,Peloton Slips After Echelon Reveals $499 'Prime Bike' With Amazon,0.0,0.841,0.159,0.1779
81,AMZN,2020-09-22,01:53PM,Dow Jones Down Slightly as Microsoft Launches New Cloud Services; Walmart+ Forecast Calls for 10 Million Subscribers,0.0,1.0,0.0,0.0
82,AMZN,2020-09-22,01:44PM,Amazon Leads Overall and Retail Category in 2020 Loyalty Leaders List,0.0,0.634,0.366,0.6369
83,AMZN,2020-09-22,01:37PM,"Nasdaq Leads Stock Gains, But Dow Lags; This Sector Rebounds",0.194,0.62,0.186,-0.0258
84,AMZN,2020-09-22,01:20PM,"Dow Jones Near Breakeven; Nasdaq Leads As Amazon, Microsoft Rally",0.0,0.841,0.159,0.1779
85,AMZN,2020-09-22,01:02PM,"US STOCKS-Nasdaq, S&P 500 rise on Amazon boost; Dow under pressure",0.151,0.548,0.301,0.296
86,AMZN,2020-09-22,12:40PM,Amazon Stock Has Gotten Crushed in September. Why One Analyst Says Its Time to Buy.,0.16,0.743,0.097,-0.2732
87,AMZN,2020-09-22,12:29PM,Apple Stock Might Be the Only Thing Standing Between the Market and Another Selloff,0.0,1.0,0.0,0.0
88,AMZN,2020-09-22,12:03PM,"Amazon adds support for Kannada, Malayalam, Tamil and Telugu in local Indian languages push ahead of Diwali",0.0,0.773,0.227,0.5267
89,AMZN,2020-09-22,12:02PM,"Dow Jones Falls 150 Points Amid Powell Comments; Amazon, Apple Jump, While Tesla Skids On Elon Musk Tweet",0.0,0.909,0.091,0.1779
90,AMZN,2020-09-22,11:59AM,Tech Stocks Pull Ahead as Wall Street Looks to Washington,0.0,1.0,0.0,0.0
91,AMZN,2020-09-22,11:56AM,GameStop Rises on Investors Plan to Make It an Amazon Rival,0.0,0.855,0.145,0.1779
92,AMZN,2020-09-22,11:35AM,"US STOCKS-Nasdaq, S&P 500 edge higher on Amazon boost; Dow under pressure",0.141,0.577,0.282,0.296
93,AMZN,2020-09-22,11:10AM,The Market Needs to Reset Periodically and Tuesday Is One of Those Days,0.0,1.0,0.0,0.0
94,AMZN,2020-09-22,10:52AM,Here's Why GameStop Stock Is Flying Higher Today,0.0,1.0,0.0,0.0
95,AMZN,2020-09-22,10:41AM,"Amazon taps Echelon for the Prime Bike, a $500 Peloton knock-off",0.0,0.841,0.159,0.1779
96,AMZN,2020-09-22,10:33AM,Amazon Shares Bounce Higher After Bernstein Upgrade to 'Outperform',0.0,0.642,0.358,0.4404
97,AMZN,2020-09-22,10:21AM,"US STOCKS-Nasdaq, S&P 500 crawl higher on Amazon, Apple boost",0.0,0.645,0.355,0.5267
98,AMZN,2020-09-22,10:16AM,Amazon Takes on Peloton With New Connected Prime Bike,0.0,0.825,0.175,0.1779
99,AMZN,2020-09-22,09:58AM,"Dow Jones Today, Stocks Flatten As Amazon Leads FANGs, Nike Up Ahead Of Earnings",0.0,0.884,0.116,0.1779
100,TSLA,2020-09-23,08:35PM,Dow Jones Futures Fall After Stock Market Sells Off Bearishly; Tesla Extends Battery Day Dive,0.0,0.903,0.097,0.128
101,TSLA,2020-09-23,07:01PM,"Jim Cramer: Tesla, Nike, and a Tale of Expectations",0.0,1.0,0.0,0.0
102,TSLA,2020-09-23,06:29PM,Why 3 Electric Vehicle Stocks Collapsed Today,0.296,0.704,0.0,-0.2732
103,TSLA,2020-09-23,06:27PM,ARK Invest's Tasha Keeney on biggest takeaways from Tesla's battery day,0.0,1.0,0.0,0.0
104,TSLA,2020-09-23,05:52PM,Tesla is preparing to take over the world with its new batteryjust not yet,0.0,1.0,0.0,0.0
105,TSLA,2020-09-23,05:50PM,California Just Banned Gas-Powered Car Sales...in 2035,0.333,0.667,0.0,-0.4588
106,TSLA,2020-09-23,05:46PM,"Tesla could struggle to implement some of its battery advances, experts say",0.173,0.827,0.0,-0.3182
107,TSLA,2020-09-23,05:40PM,Tesla Stock Tumbled After Battery Day. Heres What Wall Street Is Saying.,0.0,1.0,0.0,0.0
108,TSLA,2020-09-23,05:11PM,Tesla's Nevada lithium plan faces stark obstacles on path to production,0.206,0.794,0.0,-0.3818
109,TSLA,2020-09-23,05:04PM,SpaceX Starlink Impresses Air Force Weapons Buyer In Big Live-Fire Exercise,0.193,0.6,0.207,0.0516
110,TSLA,2020-09-23,04:58PM,"This EV Startup Is Going Public. Unlike Nikola, It Has Sales.",0.0,1.0,0.0,0.0
111,TSLA,2020-09-23,04:53PM,Tesla's Nevada lithium plan faces stark obstacles on path to production,0.206,0.794,0.0,-0.3818
112,TSLA,2020-09-23,04:47PM,Dow Falls 500 Points as Fed Warns More Stimulus Needed,0.135,0.865,0.0,-0.1027
113,TSLA,2020-09-23,04:42PM,Dow Jones Sinks Over 500 Points But This Blue Chip Soars On Earnings,0.0,1.0,0.0,0.0
114,TSLA,2020-09-23,04:38PM,Tesla Disappoints as Nasdaq Falls; Why Zoom's Still Climbing,0.245,0.755,0.0,-0.3818
115,TSLA,2020-09-23,04:36PM,US STOCKS-Wall Street closes lower on fears of a slowing economy,0.385,0.615,0.0,-0.6124
116,TSLA,2020-09-23,04:25PM,"Tesla Inc. stock falls Wednesday, underperforms market",0.0,1.0,0.0,0.0
117,TSLA,2020-09-23,04:21PM,Tesla Slumps as Battery Day Letdown Clouds $320 Billion Gain,0.0,0.726,0.274,0.5267
118,TSLA,2020-09-23,04:15PM,"Tesla Battery Day: No Sizzle, No Beef, But Lots Of Expensive Secret Sauce",0.286,0.714,0.0,-0.5267
119,TSLA,2020-09-23,04:11PM,Tesla sues Trump administration to end tariffs on the 'brain' of its vehicles,0.0,1.0,0.0,0.0
120,TSLA,2020-09-23,04:09PM,Stock market news live updates: S&P 500 closes at lowest level since July as tech shares fall anew,0.125,0.769,0.106,-0.1027
121,TSLA,2020-09-23,04:05PM,Volkswagen Launches Critical EV As California To Ban Gas Cars By 2035,0.371,0.629,0.0,-0.7096
122,TSLA,2020-09-23,04:01PM,US STOCKS-Wall Street closes lower on fears of a slowing economy,0.385,0.615,0.0,-0.6124
123,TSLA,2020-09-23,03:55PM,Tesla Stock Stumbles and the Rest of the Electric-Vehicle Industry Follows,0.0,1.0,0.0,0.0
124,TSLA,2020-09-23,03:35PM,The Nikola scandal proves even GM will do anything to catch up to Tesla,0.182,0.818,0.0,-0.4404
125,TSLA,2020-09-23,03:19PM,"Tesla stock still a buy as uptrend remains intact, chart watcher says",0.0,0.847,0.153,0.2023
126,TSLA,2020-09-23,03:17PM,Dow Jones Drops As Bears Batter Bulls; Apple Stock Surrenders Key Support,0.0,0.803,0.197,0.4019
127,TSLA,2020-09-23,02:52PM,"US STOCKS-Wall Street retreats as business activity slows, raising fears over economy",0.203,0.797,0.0,-0.4215
128,TSLA,2020-09-23,02:30PM,Dow Jones Dives 400 Points As Selling Ramps Up; Nasdaq Drops Over 2%,0.0,1.0,0.0,0.0
129,TSLA,2020-09-23,02:20PM,Tesla experienced an hour-long network outage early Wednesday,0.0,1.0,0.0,0.0
130,TSLA,2020-09-23,02:12PM,Tesla's $25K vehicle would 'bring the brand to the masses': Autoblog Editor-In-Chief,0.0,1.0,0.0,0.0
131,TSLA,2020-09-23,02:04PM,"Why Lithium Miners Like Albemarle, Lithium Americas, and Galaxy Resources Dropped Like Rocks Today",0.0,0.706,0.294,0.6124
132,TSLA,2020-09-23,01:44PM,Tesla hit with network outage: RPT,0.0,1.0,0.0,0.0
133,TSLA,2020-09-23,01:30PM,California to ban sale of new gasoline-powered passenger vehicles in 2035,0.265,0.735,0.0,-0.5574
134,TSLA,2020-09-23,01:28PM,7 of the biggest reasons why the stock market is having a dreadful September,0.209,0.791,0.0,-0.4404
135,TSLA,2020-09-23,01:14PM,US STOCKS-Wall Street retreats as business activity slows,0.0,1.0,0.0,0.0
136,TSLA,2020-09-23,12:35PM,Tesla's Value Drops $50 Billion as 'Battery Day' Disappoints,0.217,0.583,0.2,-0.0516
137,TSLA,2020-09-23,12:32PM,Why a president Joe Biden might be great for Tesla stock: analyst,0.0,0.709,0.291,0.6249
138,TSLA,2020-09-23,12:18PM,"Tesla Battery Day was long on vision and boldness, short on the here and now",0.0,0.743,0.257,0.5423
139,TSLA,2020-09-23,12:07PM,"Dow Jones Reverses Lower, But Nike Surges On Earnings; Apple Downgraded, While Tesla Dives 9% After Battery Day",0.115,0.885,0.0,-0.296
140,TSLA,2020-09-23,12:06PM,"Tesla's ""Battery Day"" Is a Dud; Stock Tumbles",0.25,0.75,0.0,-0.25
141,TSLA,2020-09-23,12:00PM,Tesla Says It Wants to Be a Lithium Miner. That Could Be a Problem for Extractor Stocks.,0.162,0.838,0.0,-0.4019
142,TSLA,2020-09-23,11:59AM,Tesla Reportedly Hit With Complete Network Outage,0.0,1.0,0.0,0.0
143,TSLA,2020-09-23,11:58AM,US STOCKS-Wall Street retreats as business activity slows,0.0,1.0,0.0,0.0
144,TSLA,2020-09-23,11:39AM,"The Dow Is Struggling, and Tesla Stock Slumps",0.286,0.714,0.0,-0.4215
145,TSLA,2020-09-23,11:19AM,Volkswagen reveals ID.4 electric SUV with 250-mile range,0.0,1.0,0.0,0.0
146,TSLA,2020-09-23,11:15AM,Why Tesla Stock Fell Sharply on Wednesday,0.0,1.0,0.0,0.0
147,TSLA,2020-09-23,11:03AM,Tesla Faces Local Backlash Over Berlin Plant,0.0,1.0,0.0,0.0
148,TSLA,2020-09-23,10:21AM,Tesla Battery Day: why the EV maker is 'superior' to others: analyst,0.0,1.0,0.0,0.0
149,TSLA,2020-09-23,10:19AM,"US STOCKS-S&P 500, Nasdaq retreat as business activity dips",0.0,0.816,0.184,0.2023
150,TSLA,2020-09-23,09:59AM,"Dow Jones Today Jumps, Nasdaq Dips As Nike Rallies; J&J Vaccine Enters Phase 3",0.0,1.0,0.0,0.0
151,TSLA,2020-09-23,09:49AM,Tesla expects approval for battery cells plant in Berlin,0.0,0.721,0.279,0.4767
152,TSLA,2020-09-23,09:44AM,Tesla expects approval for battery cells plant in Berlin,0.0,0.721,0.279,0.4767
153,TSLA,2020-09-23,09:10AM,Teslas Battery Day Was Full of Promising News. Why Its Stock Is Falling Anyway.,0.098,0.736,0.166,0.2732
154,TSLA,2020-09-23,09:01AM,This Chinese EV Maker Just Got Its First Buy Rating From Wall Street,0.0,1.0,0.0,0.0
155,TSLA,2020-09-23,08:31AM,"US STOCKS-Nike set to lift S&P 500, Dow ahead of business activity data",0.0,1.0,0.0,0.0
156,TSLA,2020-09-23,08:13AM,Dow Jones Futures Jump 200 Points As Nike Soars 13% On Earnings; Tesla Dives On Battery Day,0.0,1.0,0.0,0.0
157,TSLA,2020-09-23,08:10AM,"Tesla's stock falls, but Oppenheimer's Rusch says buy on weakness",0.291,0.709,0.0,-0.5719
158,TSLA,2020-09-23,08:00AM,Elon Musk's Tesla Stake Is Worth More Than Ford And GM,0.0,0.84,0.16,0.2263
159,TSLA,2020-09-23,07:57AM,Nikes Earnings Were Incredible. How the Company Just Did It.,0.0,1.0,0.0,0.0
160,TSLA,2020-09-23,07:51AM,Tesla's 'Battery Day' drives reality check for recent share surge,0.0,0.804,0.196,0.296
161,TSLA,2020-09-23,07:36AM,Tesla's 'Battery Day' drives reality check for recent share surge,0.0,0.804,0.196,0.296
162,TSLA,2020-09-23,07:36AM,"Tesla Sets Sights on a $25,000 Vehicle",0.0,1.0,0.0,0.0
163,TSLA,2020-09-23,07:23AM,Teslas stock skids 6% as promised Battery Day innovations remain off in the future,0.0,0.839,0.161,0.3612
164,TSLA,2020-09-23,07:10AM,"Tesla, Nike, Dow Futures, Aurora Cannabis - 5 Things You Must Know Wednesday",0.0,1.0,0.0,0.0
165,TSLA,2020-09-23,06:54AM,US STOCKS-Futures rise ahead of business activity data; Nike shines,0.0,1.0,0.0,0.0
166,TSLA,2020-09-23,06:30AM,"Tesla's stock drops, Baird analyst sees lack of catalysts with Battery Day in the rearview",0.141,0.859,0.0,-0.3182
167,TSLA,2020-09-23,02:46AM,Teslas Battery Suppliers Feel Shock From Musks Cost-Cut Push,0.245,0.755,0.0,-0.3818
168,TSLA,2020-09-23,02:17AM,Tesla Battery Day Announcements Make Suppliers Bleed At The Stock Market,0.0,1.0,0.0,0.0
169,TSLA,2020-09-23,02:10AM,PRESS DIGEST- New York Times business news - Sept 23,0.0,1.0,0.0,0.0
170,TSLA,2020-09-23,12:48AM,Tesla's Battery Day: The Biggest Takeaways,0.0,1.0,0.0,0.0
171,TSLA,2020-09-22,09:38PM,Asian suppliers' stocks slip on Tesla's cheaper battery plan,0.0,1.0,0.0,0.0
172,TSLA,2020-09-22,08:48PM,Tesla's Battery Day: A Run-Down of What Was Revealed,0.0,1.0,0.0,0.0
173,TSLA,2020-09-22,08:42PM,Tesla claims it can drive battery costs down even lower with new material science innovations,0.136,0.864,0.0,-0.296
174,TSLA,2020-09-22,07:41PM,Tesla Battery Day Event News and Meeting Notes,0.0,1.0,0.0,0.0
175,TSLA,2020-09-22,07:15PM,Tesla Previews Next-Generation Batteries; Says 2020 Deliveries Will Rise 30-40%,0.0,1.0,0.0,0.0
176,TSLA,2020-09-22,07:06PM,"Tesla says its battery innovations will deliver its goal of a $25,000 mass market electric car",0.0,1.0,0.0,0.0
177,TSLA,2020-09-22,06:59PM,Tesla introduces its tabless battery design on the road to 10 terawatt hours of production,0.0,1.0,0.0,0.0
178,TSLA,2020-09-22,06:52PM,"Future Teslas will have batteries that double as structure, making them extra stiff while improving efficiency, safety and cost",0.0,0.664,0.336,0.7964
179,TSLA,2020-09-22,06:20PM,Elon Musk Reaffirms Teslas Bullish Deliveries Forecast,0.0,1.0,0.0,0.0
180,TSLA,2020-09-22,05:41PM,"At Tesla shareholder meeting, honking greets Musk's profit promise",0.0,0.469,0.531,0.7003
181,TSLA,2020-09-22,05:19PM,'The stocks in the S&P 500 are not necessarily reflective of the full economy': Strategist,0.0,1.0,0.0,0.0
182,TSLA,2020-09-22,05:14PM,"Nasdaq Jumps 180 Points, Led By Amazon, Lululemon; Tesla Slumps Ahead Of Battery Day",0.0,0.884,0.116,0.1779
183,TSLA,2020-09-22,04:42PM,Battery day starts on a low note with Musks warnings,0.381,0.619,0.0,-0.5106
184,TSLA,2020-09-22,04:25PM,Tesla Inc. stock underperforms Tuesday when compared to competitors,0.0,1.0,0.0,0.0
185,TSLA,2020-09-22,04:24PM,"US STOCKS-Wall Street closes higher on Amazon boost, despite economic worries",0.0,0.543,0.457,0.6939
186,TSLA,2020-09-22,04:23PM,Will Battery Day Surpass Expectations And Give A Jolt To Tesla Stock?,0.0,1.0,0.0,0.0
187,TSLA,2020-09-22,04:18PM,Stocks End Higher as Tech Leads Amid Economic Uncertainty,0.231,0.769,0.0,-0.34
188,TSLA,2020-09-22,04:00PM,"US STOCKS-Wall Street closes higher on Amazon boost, despite economic worries",0.0,0.543,0.457,0.6939
189,TSLA,2020-09-22,03:53PM,How Tesla stacks up against other tech juggernauts at similar stages  theres good news and bad news,0.164,0.701,0.136,-0.1531
190,TSLA,2020-09-22,03:05PM,Top 20 Richest People In The World,0.0,0.49,0.51,0.6369
191,TSLA,2020-09-22,03:03PM,Stock Market Today With Jim Cramer: Tesla's Battery Day Hype,0.0,1.0,0.0,0.0
192,TSLA,2020-09-22,02:56PM,"US STOCKS-Wall Street gains on Amazon boost, despite worries over economy",0.0,0.434,0.566,0.7982
193,TSLA,2020-09-22,02:55PM,Here's what to expect from Tesla's Battery Day event,0.0,1.0,0.0,0.0
194,TSLA,2020-09-22,02:00PM,Oil Still Stuck at $40,0.333,0.667,0.0,-0.25
195,TSLA,2020-09-22,01:24PM,Why CleanSpark Stock Fell on Tuesday,0.0,1.0,0.0,0.0
196,TSLA,2020-09-22,01:20PM,"Dow Jones Near Breakeven; Nasdaq Leads As Amazon, Microsoft Rally",0.0,0.841,0.159,0.1779
197,TSLA,2020-09-22,01:16PM,"Tesla Battery Day: Look Out for the Devil in the Details, Suggests Analyst",0.268,0.732,0.0,-0.6597
198,TSLA,2020-09-22,01:02PM,"US STOCKS-Nasdaq, S&P 500 rise on Amazon boost; Dow under pressure",0.151,0.548,0.301,0.296
199,TSLA,2020-09-22,12:59PM,"Tesla's 'Battery Day', what to watch for",0.0,1.0,0.0,0.0
200,GOOG,2020-09-23,06:24PM,Barr Remains Wary of Security Concerns in Oracles TikTok Deal,0.0,0.789,0.211,0.34
201,GOOG,2020-09-23,05:26PM,"DOJ's Investigation Of Google 'Important' For Stock, BofA Says",0.0,1.0,0.0,0.0
202,GOOG,2020-09-23,04:25PM,Apple Inc. stock underperforms Wednesday when compared to competitors,0.0,1.0,0.0,0.0
203,GOOG,2020-09-23,04:25PM,"Amazon.com Inc. stock falls Wednesday, underperforms market",0.0,1.0,0.0,0.0
204,GOOG,2020-09-23,04:25PM,"Alphabet Inc. Cl A stock falls Wednesday, underperforms market",0.0,1.0,0.0,0.0
205,GOOG,2020-09-23,03:07PM,TikTok asks judge to block U.S. from barring app for download,0.225,0.775,0.0,-0.4404
206,GOOG,2020-09-23,02:56PM,DOJ Petitions Congress to Curb Legal Protections for Internet Companies,0.0,0.857,0.143,0.128
207,GOOG,2020-09-23,12:33PM,Google Maps gets a COVID-19 layer,0.0,1.0,0.0,0.0
208,GOOG,2020-09-23,12:30PM,Where Will Amazon Be in 10 Years?,0.0,0.779,0.221,0.1779
209,GOOG,2020-09-23,11:45AM,Facebook Tool Faulted for Lapses in Finding Voter Misinformation,0.402,0.598,0.0,-0.5719
210,GOOG,2020-09-23,11:37AM,Google Antitrust Lawsuit to Narrowly Focus on Search Dominance,0.178,0.654,0.168,-0.0258
211,GOOG,2020-09-23,10:19AM,EU's antitrust probe of Google-Fitbit gets more time,0.0,1.0,0.0,0.0
212,GOOG,2020-09-23,09:00AM,"Thailand to start legal action vs Facebook, Google, Twitter over content",0.0,0.87,0.13,0.128
213,GOOG,2020-09-23,08:10AM,"EU regulators extend Google, Fitbit deal probe to Dec. 23",0.0,0.841,0.159,0.1779
214,GOOG,2020-09-23,07:28AM,Is Google-Backed Telemedicine Stock Amwell a Buy After Its IPO?,0.0,1.0,0.0,0.0
215,GOOG,2020-09-23,07:07AM,A Deep Dive Into JFrog -- the Tech Company Keeping Your Software Updated,0.0,1.0,0.0,0.0
216,GOOG,2020-09-23,06:08AM,Is This Hot IPO Stock a Better Buy Than Teladoc Health?,0.0,0.756,0.244,0.4404
217,GOOG,2020-09-23,05:14AM,"Facebook, Twitter, YouTube Make Peace With Advertisers Over Harmful Content: FT",0.0,0.741,0.259,0.5423
218,GOOG,2020-09-23,03:22AM,"Not All FAANG Stocks Are Going To Be Winners, Munster Says",0.0,0.763,0.237,0.4767
219,GOOG,2020-09-22,10:29PM,Blacklisting U.S. Tech Would Highlight Chinas Own Weakness,0.25,0.536,0.214,-0.1027
220,GOOG,2020-09-22,09:15PM,Capital One and PayPal Veterans Roll Out Next-Generation Banking App,0.0,1.0,0.0,0.0
221,GOOG,2020-09-22,08:20PM,A $50 Phone is Ambani's Weapon to Dominate India Telecom Market,0.316,0.684,0.0,-0.4019
222,GOOG,2020-09-22,08:14PM,Trump to Meet With State Enforcers Before Expected Google Case,0.0,1.0,0.0,0.0
