,ticker,date,time,headline,neg,neu,pos,compound
0,PFE,2020-09-28,08:59PM,Coronavirus update: World tops 1M deaths; Inovio delays late-stage trial as vaccine race quickens,0.0,0.798,0.202,0.5106
1,PFE,2020-09-28,05:45PM,Pfizer (PFE) Gains But Lags Market: What You Should Know,0.194,0.62,0.186,-0.0258
2,PFE,2020-09-28,05:10PM,Biotech ETFs in Focus as the COVID-19 Vaccine Race Intensifies,0.0,1.0,0.0,0.0
3,PFE,2020-09-28,05:06PM,"Sareptas First Gene-Therapy Test Patients Look Good, Two Years Out",0.0,0.756,0.244,0.4404
4,PFE,2020-09-28,04:54PM,U.S. FDA Approves Pfizers XELJANZ® (tofacitinib) for the Treatment of Active Polyarticular Course Juvenile Idiopathic Arthritis,0.0,0.722,0.278,0.6597
5,PFE,2020-09-28,04:23PM,Inovio Forced To Delay Planned Testing Of Covid-19 Vaccine; Stock Plummets,0.371,0.629,0.0,-0.6486
6,PFE,2020-09-28,02:44PM,Inovio Stock Tumbles After Covid-19 Vaccine Trial Is Halted,0.0,1.0,0.0,0.0
7,PFE,2020-09-28,08:56AM,"10 Stocks to Buy as the Health-Care Revolution Races Ahead, According to Experts",0.0,1.0,0.0,0.0
8,PFE,2020-09-27,06:40AM,The 2 Coronavirus Vaccine Stocks I'd Buy Right Now,0.0,1.0,0.0,0.0
9,PFE,2020-09-27,06:30AM,3 Dividend Stocks That Pay You Better Than Coca-Cola Does,0.124,0.619,0.257,0.3612
10,PFE,2020-09-27,06:04AM,A Second Wave of Coronavirus Could Be Coming: 3 Stocks to Buy Before It Hits,0.0,1.0,0.0,0.0
11,PFE,2020-09-26,06:16AM,Better Coronavirus Stock: BioNTech or Vir Biotechnology?,0.0,0.674,0.326,0.4404
12,PFE,2020-09-25,04:25PM,"Johnson & Johnson stock rises Friday, still underperforms market",0.0,1.0,0.0,0.0
13,PFE,2020-09-25,02:44PM,There are four coronavirus vaccines in late-stage studies  heres how they differ,0.0,1.0,0.0,0.0
14,PFE,2020-09-25,02:33PM,"The Zacks Analyst Blog Highlights: JNJ, Pfizer, AstraZeneca, Sanofi and GSK",0.0,1.0,0.0,0.0
15,PFE,2020-09-25,11:49AM,"COVID-19 trials enter late stages, here's when you should expect a vaccine",0.0,1.0,0.0,0.0
16,PFE,2020-09-25,10:39AM,"U.S. nears 7M coronavirus cases, big pharmaceutical companies race for a vaccine",0.0,1.0,0.0,0.0
17,PFE,2020-09-25,09:07AM,Another Covid-19 Vaccine Candidate Is in the Final Stage of Testing,0.0,1.0,0.0,0.0
18,PFE,2020-09-24,10:23PM,Novavax Shares Surge 7% As It Begins Late-Stage COVID-19 Vaccine Trials,0.0,0.82,0.18,0.296
19,PFE,2020-09-24,06:45PM,All the Covid-19 Vaccine Candidates That Are Now in Final Trials,0.0,1.0,0.0,0.0
20,PFE,2020-09-24,04:25PM,"Johnson & Johnson stock rises Thursday, still underperforms market",0.0,1.0,0.0,0.0
21,PFE,2020-09-24,04:14PM,Moderna Stock Cant Go Much HigherEven If It Makes a Covid-19 Vaccine,0.0,1.0,0.0,0.0
22,PFE,2020-09-24,03:09PM,Moderna Analyst On 4 Coronavirus Vaccine Program Risks,0.259,0.741,0.0,-0.2732
23,PFE,2020-09-24,03:07PM,U.S. vaccine program chief backs stricter rules for emergency use of COVID-19 shot,0.257,0.743,0.0,-0.4215
24,PFE,2020-09-24,12:14PM,Coronavirus update: Trump suggests he may overrule FDA vaccine approval; airlines ramp up testing,0.0,0.807,0.193,0.4767
25,PFE,2020-09-24,11:33AM,Current Updates On COVID-19 Vaccine,0.0,1.0,0.0,0.0
26,PFE,2020-09-24,06:09AM,4 Coronavirus Vaccine Stocks the Bill & Melinda Gates Foundation Is Betting On,0.0,1.0,0.0,0.0
27,PFE,2020-09-23,04:25PM,Johnson & Johnson stock outperforms competitors on strong trading day,0.0,0.708,0.292,0.5106
28,PFE,2020-09-23,04:20PM,Johnson & Johnson Is Latest To Start Final-Phase Testing For Covid-19 Vaccine,0.0,1.0,0.0,0.0
29,PFE,2020-09-23,04:07PM,GoodRx IPO Surges; Drug Shopping App Value Soars To $19 Billion,0.0,0.806,0.194,0.34
30,PFE,2020-09-23,02:13PM,Johnson & Johnson CSO on COVID-19 vaccine: We wont have it by October  maybe by the end of the year,0.0,1.0,0.0,0.0
31,PFE,2020-09-23,01:28PM,'Pandemic fatigue is hitting the nation': Expert,0.25,0.75,0.0,-0.25
32,PFE,2020-09-23,11:06AM,FDA commissioner: It's up to drug makers developing vaccines to seek approval or EUA,0.0,0.807,0.193,0.4767
33,PFE,2020-09-23,10:52AM,"Fauci predicts U.S. will know if COVID-19 vaccines are effective by ""November or December""",0.0,0.807,0.193,0.4767
34,PFE,2020-09-23,10:51AM,J&J Launches Trial of Single-Dose Covid Vaccine. Results Could Come Quicker Than You Think.,0.0,1.0,0.0,0.0
35,PFE,2020-09-23,10:37AM,MediciNova Stock Spikes on Coronavirus-Vaccine Progress,0.0,0.641,0.359,0.4215
36,PFE,2020-09-23,08:52AM,Coronavirus update: Johnson & Johnson vaccine enters phase 3 as Fauci heads to Senate,0.0,1.0,0.0,0.0
37,PFE,2020-09-23,08:07AM,Here's My Top Coronavirus Vaccine Stock to Buy,0.0,0.795,0.205,0.2023
38,PFE,2020-09-23,06:45AM,"J&J kicks off final study of single-shot COVID-19 vaccine in 60,000 volunteers",0.0,1.0,0.0,0.0
39,PFE,2020-09-23,06:12AM,3 Safe Coronavirus Stocks to Buy Ahead of a Market Crash,0.214,0.556,0.23,0.0516
40,PFE,2020-09-23,05:48AM,2 High-Yield Dividend Stocks I'd Buy Right Now,0.0,1.0,0.0,0.0
41,PFE,2020-09-22,05:19PM,Everything you need to know about what it would take for the FDA to approve a COVID-19 vaccine,0.0,1.0,0.0,0.0
42,PFE,2020-09-22,04:25PM,Coronavirus update: US death toll tops 200K as Europe outlook darkens; FDA adds teeth to vaccine process,0.176,0.676,0.149,-0.1531
43,PFE,2020-09-22,04:25PM,Johnson & Johnson stock underperforms Tuesday when compared to competitors,0.0,1.0,0.0,0.0
44,PFE,2020-09-22,12:19PM,Axsome Expedites Development Plan for Narcolepsy Candidate,0.0,1.0,0.0,0.0
45,PFE,2020-09-22,10:01AM,4 Biotechs That Have More Than Doubled Thanks to Coronavirus,0.0,0.717,0.283,0.4877
46,PFE,2020-09-22,10:00AM,Pfizer Invites Public to View and Listen to Webcast of October 27 Conference Call with Analysts,0.0,1.0,0.0,0.0
47,PFE,2020-09-22,08:35AM,India's Serum Institute starts manufacturing Codagenix's potential COVID-19 vaccine,0.0,1.0,0.0,0.0
48,PFE,2020-09-22,06:09AM,Why Pfizer's Latest Big Win Makes It an Even Better Buy for Retirees,0.0,0.621,0.379,0.7717
49,PFE,2020-09-21,05:45PM,Pfizer (PFE) Dips More Than Broader Markets: What You Should Know,0.0,1.0,0.0,0.0
50,PFE,2020-09-21,04:31PM,Covid Report: AstraZeneca Now Seen As Lagging In Vaccine Race,0.189,0.811,0.0,-0.2732
51,PFE,2020-09-21,04:25PM,"Johnson & Johnson stock falls Monday, underperforms market",0.0,1.0,0.0,0.0
52,PFE,2020-09-21,03:33PM,Column: Did drug makers really stand up to Trump over those 'Trump card' discounts? Doubtful,0.146,0.854,0.0,-0.34
53,PFE,2020-09-21,10:42AM,Anticancer Drug Team-Ups Show Promise. 4 Stocks That Stand to Gain.,0.0,0.584,0.416,0.6908
54,PFE,2020-09-21,10:35AM,U.S. closes in on 200K COVID-19 death milestone,0.358,0.642,0.0,-0.5994
55,PFE,2020-09-21,08:00AM,AbbVie Joins The Coronavirus Drug Hunt  Is AbbVie Stock A Buy?,0.0,1.0,0.0,0.0
56,PFE,2020-09-21,05:35AM,Normality could return in summer 2021 if vaccine succeeds - UK health minister,0.0,0.775,0.225,0.4939
57,PFE,2020-09-21,02:27AM,Pfizer Reveals Efficacy Criteria For Key Covid-19 Vaccine Trials,0.0,1.0,0.0,0.0
58,PFE,2020-09-20,08:23AM,3 Biotech Stocks Poised For Massive Future Growth,0.0,0.521,0.479,0.5574
59,PFE,2020-09-20,06:09AM,3 Best Coronavirus Vaccine Stocks to Buy Right Now,0.0,0.625,0.375,0.6369
60,PFE,2020-09-18,07:13PM,Is Pfizer Stock a Buy Right Now? This Is What You Need to Know,0.0,1.0,0.0,0.0
61,PFE,2020-09-18,06:05PM,Bristol Myers' Opdivo with Exelixis drug cuts kidney cancer death risk -study,0.612,0.388,0.0,-0.9118
62,PFE,2020-09-18,04:44PM,"We have to continue to be really, really vigilant in maintaining our health infrastructure: Dr. Amesh Adalja",0.0,0.876,0.124,0.3119
63,PFE,2020-09-18,04:25PM,Johnson & Johnson stock outperforms competitors on strong trading day,0.0,0.708,0.292,0.5106
64,PFE,2020-09-18,03:57PM,EXPLAINER-When will COVID-19 vaccines be generally available in the U.S.?,0.0,1.0,0.0,0.0
65,PFE,2020-09-18,03:12PM,Three-quarters of Americans are worried about the vaccine rush: Pew,0.196,0.804,0.0,-0.296
66,PFE,2020-09-18,02:36PM,Novavax Stock Is a Risky Way to Get Rich Quick,0.145,0.565,0.29,0.4215
67,PFE,2020-09-18,01:58PM,iBio Is a Wishful Thinkers Coronavirus Vaccine Bet,0.0,1.0,0.0,0.0
68,PFE,2020-09-18,11:12AM,EXPLAINER-When will COVID-19 vaccines be generally available in the U.S.?,0.0,1.0,0.0,0.0
69,PFE,2020-09-18,10:20AM,Unusual Options Activity Insight: Pfizer,0.0,1.0,0.0,0.0
70,PFE,2020-09-18,09:51AM,Why Novartis Absence From the Covid-19 Vaccine Race Is a Benefit,0.0,0.75,0.25,0.4588
71,PFE,2020-09-18,09:26AM,Is Sorrento Stock Really Worth the Speculation?,0.0,0.732,0.268,0.2944
72,PFE,2020-09-18,09:26AM,"Moderna CEO downplays vaccine timeline pressure: 'We don't want the first, we want the best'",0.234,0.554,0.212,0.3728
73,PFE,2020-09-18,06:10AM,3 Dividend Stocks Perfect for Retirees,0.0,0.519,0.481,0.5719
74,PFE,2020-09-18,06:08AM,3 Coronavirus Vaccines in Phase 3 Clinical Studies: How They Stack Up Against Each Other,0.0,1.0,0.0,0.0
75,PFE,2020-09-18,05:46AM,"BioNTech Investor Fortunes Rise and Fall on Headlines, Pacts and Funding",0.0,1.0,0.0,0.0
76,PFE,2020-09-17,10:08PM,"Pfizer vaccine trial bets on early win against coronavirus, documents show",0.0,0.725,0.275,0.5859
77,PFE,2020-09-17,05:48PM,EXPLAINER-When will COVID-19 vaccines be generally available in the U.S.?,0.0,1.0,0.0,0.0
78,PFE,2020-09-17,05:23PM,Moderna Shares the Latest on its Coronavirus Vaccine Trial and Other Research Advances,0.0,0.845,0.155,0.296
79,PFE,2020-09-17,05:02PM,Economic recovery wont come until we get Americans to feel safe: Ric Edelman,0.0,0.805,0.195,0.4404
80,PFE,2020-09-17,04:54PM,"Infectious Diseases Physician on COVID-19 vaccine outlook: 'Its less about whats the exact date, but making sure its effective'",0.0,0.705,0.295,0.7964
81,PFE,2020-09-17,04:25PM,Johnson & Johnson stock underperforms Thursday when compared to competitors,0.0,1.0,0.0,0.0
82,PFE,2020-09-17,04:20PM,BioNTech Buys a Plant to Manufacture Its Coronavirus Vaccine,0.0,1.0,0.0,0.0
83,PFE,2020-09-17,04:16PM,"Moderna Updates Progress On Covid-19 Vaccine, Eyes Flu Vaccine",0.21,0.565,0.226,0.0516
84,PFE,2020-09-17,03:29PM,"FOCUS-Pfizer vaccine trial bets on early win against coronavirus, documents show",0.0,0.725,0.275,0.5859
85,PFE,2020-09-17,11:06AM,"Race for a COVID-19 vaccine continues, here's what you need to know",0.0,1.0,0.0,0.0
86,PFE,2020-09-17,11:00AM,Coronavirus update: Vaccine makers ramp up manufacturing as Trump stirs debate; NYC to delay school reopen,0.133,0.867,0.0,-0.3182
87,PFE,2020-09-17,08:08AM,3 Reasons Why You Probably Won't Receive a Coronavirus Vaccine Shot by the End of 2020,0.0,1.0,0.0,0.0
88,PFE,2020-09-17,07:22AM,Moderna to seek limited emergency use of COVID-19 vaccine if data shows high efficacy,0.273,0.727,0.0,-0.5423
89,PFE,2020-09-17,07:00AM,Moderna would seek limited emergency use of COVID-19 vaccine based on early data,0.29,0.71,0.0,-0.5423
90,PFE,2020-09-17,06:05AM,Here's the Company That Bill Gates Thinks Is the Clear Coronavirus Vaccine Leader,0.0,0.822,0.178,0.3818
91,PFE,2020-09-16,04:43PM,U.S. Cases Rise 0.4%; Californias Outbreak Easing: Virus Update,0.0,0.8,0.2,0.25
92,PFE,2020-09-16,04:25PM,"Johnson & Johnson stock falls Wednesday, still outperforms market",0.0,1.0,0.0,0.0
93,PFE,2020-09-16,03:54PM,Coronavirus Vaccine Trial Adverse Event Was Probably Unrelated to Treatment,0.217,0.783,0.0,-0.3612
94,PFE,2020-09-16,02:04PM,Cos. with a real vaccine history will have their data sets in early 2021: Expert,0.0,1.0,0.0,0.0
95,PFE,2020-09-16,01:57PM,Lilly and Pfizer Are Testing Treatments for Hospitalized Covid Patients,0.0,1.0,0.0,0.0
96,PFE,2020-09-16,12:57PM,Coronavirus update: Operation Warp Speed readies for vaccine as CDC tries to manage expectations,0.0,1.0,0.0,0.0
97,PFE,2020-09-16,10:29AM,How Pfizer Plans to Lead the Industry in Gene Therapies,0.0,1.0,0.0,0.0
98,PFE,2020-09-16,08:33AM,This 3-Stock Portfolio Is a Safe Bet on a Coronavirus Vaccine,0.0,0.734,0.266,0.4404
99,PFE,2020-09-16,08:00AM,Pfizer Says Its Covid Vaccine Is Just the First in a New Wave of Preventives,0.0,1.0,0.0,0.0
