,ticker,date,time,headline,neg,neu,pos,compound
0,RACE,2020-09-24,12:01PM,Can Ferrari N.V.'s (NYSE:RACE) ROE Continue To Surpass The Industry Average?,0.0,1.0,0.0,0.0
1,RACE,2020-09-21,07:47AM,Hunting for Stock-Market Bargains? Look Abroad.,0.0,1.0,0.0,0.0
2,RACE,2020-09-16,12:10PM,Ferrari gives GT bestseller a makeover with new Portofino M,0.0,0.712,0.288,0.4278
3,RACE,2020-09-14,03:30PM,Can Ferrari Turn Around After Driving Off a Cliff?,0.0,1.0,0.0,0.0
4,RACE,2020-09-13,10:52AM,3 Stocks for an Electric Vehicle Future Not Named Tesla or Nikola,0.0,1.0,0.0,0.0
5,RACE,2020-09-09,04:56PM,Virgin Galactic Gets Another Upgrade. Now It Joins an Elite List.,0.0,1.0,0.0,0.0
6,RACE,2020-09-05,07:35AM,"Forget Airline Stocks, These 3 Stocks Are Better Buys Right Now",0.148,0.625,0.227,0.25
7,RACE,2020-09-02,08:15AM,Is Tesla stock now in dangerous bubble territory? This shocking new number should frighten the bulls,0.381,0.558,0.06,-0.7845
8,RACE,2020-08-25,01:13PM,Here's What Ferrari N.V.'s (NYSE:RACE) Shareholder Ownership Structure Looks Like,0.0,0.783,0.217,0.3612
9,RACE,2020-08-25,08:47AM,McLarens Once-a-Decade Debut Augurs Hybrid Supercar Future,0.0,1.0,0.0,0.0
10,RACE,2020-08-19,02:30AM,Detroit and Germany Already Have Their Own Teslas,0.0,1.0,0.0,0.0
11,RACE,2020-08-18,11:53AM,Ferrari signs the 2021-2025 Concorde Agreement,0.0,0.61,0.39,0.4939
12,RACE,2020-08-13,09:21AM,Morgan Stanley Lifts Ferraris PT To Street High,0.0,1.0,0.0,0.0
13,RACE,2020-08-12,10:43AM,"Ferrari Stock Could Double on SUV, EV Moves, Analyst Says",0.0,1.0,0.0,0.0
14,RACE,2020-08-12,09:25AM,"Ferraris Price Target Raised to $265 on Growth Optimism, $350 in Best-Case Scenario: Morgan Stanley",0.0,0.681,0.319,0.7269
15,RACE,2020-08-11,11:40AM,SHYF or RACE: Which Is the Better Value Stock Right Now?,0.0,0.629,0.371,0.6486
16,RACE,2020-08-03,06:05PM,"Ferrari's Profit Dropped Sharply on Coronavirus Effects, but There's Good News, Too",0.0,0.633,0.367,0.7003
17,RACE,2020-08-03,05:00PM,Ferrari N.V. (RACE) Q2 2020 Earnings Call Transcript,0.0,1.0,0.0,0.0
18,RACE,2020-08-03,03:07PM,Ferrari Revs to Highs Despite Earnings Miss - Here's the Trade,0.0,0.862,0.138,0.1139
19,RACE,2020-08-03,01:35PM,The Rich Still Want to Buy Their Ferraris,0.0,0.55,0.45,0.5994
20,RACE,2020-08-03,09:25AM,Ferrari (RACE) Misses Q2 Earnings and Revenue Estimates,0.213,0.787,0.0,-0.2263
21,RACE,2020-08-03,08:51AM,Ferrari Stock Ticks Higher After Mixed Earnings Report,0.0,1.0,0.0,0.0
22,RACE,2020-08-03,07:45AM,Ferrari's orders accelerate after virus hit to full-year outlook,0.0,1.0,0.0,0.0
23,RACE,2020-07-28,04:13PM,Best Automotive Stocks For 2020 According To Hedge Funds,0.0,0.656,0.344,0.6369
24,RACE,2020-07-27,12:31PM,Analysts Estimate Ferrari (RACE) to Report a Decline in Earnings: What to Look Out for,0.0,1.0,0.0,0.0
25,RACE,2020-07-26,09:34AM,Investors Who Bought Ferrari (NYSE:RACE) Shares Three Years Ago Are Now Up 69%,0.0,0.845,0.155,0.296
26,RACE,2020-07-15,02:57PM,Tesla share price is a beast that cannot be stopped: analyst,0.0,0.674,0.326,0.434
27,RACE,2020-07-14,11:27AM,"Tesla News Roundup: A German Court Nixes the Autopilot Name, and Piper Sandler Goes Fully Bullish",0.0,1.0,0.0,0.0
28,RACE,2020-07-12,12:52PM,Did Hedge Funds Make The Right Call On Ferrari N.V. (RACE) ?,0.0,1.0,0.0,0.0
29,RACE,2020-07-10,01:29PM,COVID-19 is steering consumers to buy cars online: Carvana CEO,0.0,1.0,0.0,0.0
30,RACE,2020-07-09,08:18AM,Markets Now - Thursday 9th July 2020,0.0,1.0,0.0,0.0
31,RACE,2020-07-08,06:34PM,Why Ferrari Could Have Additional Upside,0.0,1.0,0.0,0.0
32,RACE,2020-07-03,10:50AM,First Drive: Ferrari F8 Spider,0.0,1.0,0.0,0.0
33,RACE,2020-06-30,12:26PM,Charlie Munger: Sometimes It's Better to Raise Prices,0.0,0.707,0.293,0.4404
34,RACE,2020-06-29,10:29AM,A Look Into Ferrari's Price Over Earnings,0.0,1.0,0.0,0.0
35,RACE,2020-06-26,11:40AM,SHYF vs. RACE: Which Stock Is the Better Value Option?,0.0,0.602,0.398,0.6486
36,RACE,2020-06-26,08:28AM,Ford COO: New F-150 pickup truck essential to carmaker's future,0.0,1.0,0.0,0.0
37,RACE,2020-06-19,12:08PM,Why young Black Britons feel police must change,0.0,1.0,0.0,0.0
38,RACE,2020-06-09,11:40AM,SHYF or RACE: Which Is the Better Value Stock Right Now?,0.0,0.629,0.371,0.6486
39,RACE,2020-06-08,01:44AM,Hedge Funds Cashing Out Of Ferrari N.V. (RACE),0.0,1.0,0.0,0.0
40,RACE,2020-06-05,09:00AM,Keep These 4 Toxic Stocks Off Your Portfolio to Avoid Losses,0.38,0.62,0.0,-0.5994
41,RACE,2020-06-04,02:07PM,Lamborghini sales stay hot with stock market soaring again: CEO,0.0,1.0,0.0,0.0
42,RACE,2020-05-28,07:04AM,Is Ferrari Stock a Buy?,0.0,1.0,0.0,0.0
43,RACE,2020-05-27,07:41AM,Ferrari Announces Settlement of its Notes offering,0.0,1.0,0.0,0.0
44,RACE,2020-05-20,05:23PM,Ferrari Pricing of Issue of Notes,0.0,1.0,0.0,0.0
45,RACE,2020-05-20,07:00AM,"Why a Top Stock Fund Likes Ferrari, Moodys, and MSCI",0.0,0.603,0.397,0.5574
46,RACE,2020-05-20,03:02AM,Ferrari Announces Offering of Notes,0.0,1.0,0.0,0.0
47,RACE,2020-05-18,01:18PM,Edited Transcript of RACE earnings conference call or presentation 4-May-20 1:00pm GMT,0.0,1.0,0.0,0.0
48,RACE,2020-05-14,08:18AM,"F1's Carlos Sainz Jr. will go to Ferrari, Daniel Ricciardo to McLaren",0.0,1.0,0.0,0.0
49,RACE,2020-05-13,08:49AM,Ferrari mule lapping Fiorano could house V6 hybrid,0.0,1.0,0.0,0.0
50,RACE,2020-05-12,08:25AM,"Sebastian Vettel, Ferrari ending their frustrating relationship at F1 season's end",0.225,0.775,0.0,-0.4404
51,RACE,2020-05-11,10:20AM,P/E Ratio Insights for Ferrari,0.0,1.0,0.0,0.0
52,RACE,2020-05-11,08:29AM,Mario Andretti would love to see Ferrari join Indycar,0.0,0.522,0.478,0.7506
53,RACE,2020-05-07,10:52AM,One Car Maker That Will Emerge Stronger From the Pandemic. Its Not Who You Might Think.,0.0,0.852,0.148,0.3818
54,RACE,2020-05-06,05:40PM,Lawmakers push for auto industry bailout,0.219,0.781,0.0,-0.1027
55,RACE,2020-05-06,04:04PM,Were Hedge Funds Right About Ferrari N.V. (RACE)?,0.0,1.0,0.0,0.0
56,RACE,2020-05-05,09:27AM,"Company News for May 5, 2020",0.0,1.0,0.0,0.0
57,RACE,2020-05-04,04:09PM,"Dow Jones Closes Higher Despite Trump's Coronavirus Claims, As Energy, Techs Rally",0.0,0.84,0.16,0.2732
58,RACE,2020-05-04,04:02PM,Supercar Maker's Earnings Beat As U.S. Auto Industry Faces Worst-Ever Sales,0.0,1.0,0.0,0.0
59,RACE,2020-05-04,04:00PM,Ferrari N.V. (RACE) Q1 2020 Earnings Call Transcript,0.0,1.0,0.0,0.0
60,RACE,2020-05-04,12:44PM,Ferrari Cuts 2020 Profit Forecast on Coronavirus Disruptions,0.368,0.4,0.232,-0.1779
61,RACE,2020-05-04,11:22AM,Ferrari slashes 2020 earnings forecast because of coronavirus pandemic,0.184,0.816,0.0,-0.2023
62,RACE,2020-05-04,11:15AM,Ferrari (RACE) Tops Q1 Earnings and Revenue Estimates,0.0,0.68,0.32,0.5106
63,RACE,2020-05-04,08:54AM,"Ferrari slowed by coronavirus, but not driven off course",0.0,1.0,0.0,0.0
64,RACE,2020-05-04,07:51AM,Ferrari: Q1 Earnings Insights,0.0,1.0,0.0,0.0
65,RACE,2020-05-04,07:48AM,"Ferrari cuts FY guidance due to coronavirus, sees slight drop in core profit",0.25,0.581,0.169,-0.1027
66,RACE,2020-05-04,07:07AM,"Sound Core Business Growth in q1 2020, GUIDANCE REVISED TO REFLECT PRESENT CONSTRAINTS AND UNCERTAINTIES",0.167,0.694,0.139,-0.1363
67,RACE,2020-04-30,02:45PM,Ferrari to gradually restart operations from Monday,0.0,1.0,0.0,0.0
68,RACE,2020-04-30,09:00AM,Ferrari to gradually restart operations from Monday,0.0,1.0,0.0,0.0
69,RACE,2020-04-30,08:30AM,"Ferrari starts the Installation Lap phase, courses on new safety regulations.",0.0,0.781,0.219,0.4215
70,RACE,2020-04-28,12:48PM,Ferrari to announce First Quarter 2020 financial results on May 4,0.0,1.0,0.0,0.0
71,RACE,2020-04-27,01:20PM,Ferrari SF90 Stradale Spider spied out testing for the first time,0.0,1.0,0.0,0.0
72,RACE,2020-04-27,12:32PM,Analysts Estimate Ferrari (RACE) to Report a Decline in Earnings: What to Look Out for,0.0,1.0,0.0,0.0
73,RACE,2020-04-24,09:53AM,Ferrari remains on track to introduce two models in 2020,0.0,1.0,0.0,0.0
74,RACE,2020-04-22,09:20AM,"Torque Esports Enters into Definitive Agreement to Acquire 100% of Market-Leading Motorsport Simulator Manufacturer, Allinsports",0.0,0.814,0.186,0.4939
75,RACE,2020-04-21,02:05PM,Carroll Cos. owns the resources to motor ahead during pandemic,0.0,1.0,0.0,0.0
76,RACE,2020-04-21,10:09AM,Ferrari leads the way with coronavirus screening to get staff back to work,0.0,1.0,0.0,0.0
77,RACE,2020-04-21,05:06AM,Ferrari rolls out coronavirus testing to get staff ready for work,0.0,0.8,0.2,0.3612
78,RACE,2020-04-21,02:02AM,Ferrari rolls out coronavirus testing to get staff ready for work,0.0,0.8,0.2,0.3612
79,RACE,2020-04-20,11:02AM,Ferrari Portofino spy shots show refreshed front end,0.0,1.0,0.0,0.0
80,RACE,2020-04-16,12:46PM,Ferrari 3D prints parts to turn snorkel masks into coronavirus protection kits,0.0,1.0,0.0,0.0
81,RACE,2020-04-16,10:51AM,Ferrari announces voting results from its Annual General Meeting,0.0,1.0,0.0,0.0
82,RACE,2020-04-16,09:25AM,Ferrari makes parts to turn snorkel masks into coronavirus kit,0.0,1.0,0.0,0.0
83,RACE,2020-04-10,02:57PM,Ferrari extends Maranello and Modena manufacturing suspension until 3 May 2020.,0.0,0.857,0.143,0.128
84,RACE,2020-04-10,02:11PM,3 Categories to Hedge Inflation,0.0,1.0,0.0,0.0
85,RACE,2020-04-08,04:40PM,Ferrari to pilot 'Back on Track' employee screening for coronavirus,0.0,1.0,0.0,0.0
86,RACE,2020-04-08,04:28PM,Ferrari N.V.: 2020 Annual General Meeting,0.0,1.0,0.0,0.0
87,RACE,2020-04-08,11:29AM,Agnelli family's Exor vows to push through big deals despite pandemic,0.0,1.0,0.0,0.0
88,RACE,2020-04-08,04:04AM,EU science chief resigns with blast at coronavirus response,0.223,0.777,0.0,-0.3182
89,RACE,2020-04-04,03:35PM,Invest in Exclusivity for Unfair Advantages,0.323,0.417,0.26,-0.1531
90,RACE,2020-04-01,04:48PM,Ferrari N.V.: Termination of the third tranche of the disclosed multi-year share repurchase program,0.0,0.855,0.145,0.296
91,RACE,2020-03-31,11:40AM,ADNT vs. RACE: Which Stock Is the Better Value Option?,0.0,0.602,0.398,0.6486
92,RACE,2020-03-30,06:47AM,Ferrari N.V.: periodic report on the buyback program,0.0,1.0,0.0,0.0
93,RACE,2020-03-28,01:19PM,Ferrari Portofino: the most attainable Ferrari is one of its best,0.0,0.704,0.296,0.6369
94,RACE,2020-03-27,05:11AM,Ferrari extends Italian plant closures to April 14 subject to supplies,0.0,0.87,0.13,0.128
95,RACE,2020-03-27,03:11AM,Ferrari to resume production in Maranello and Modena as of 14 April 2020.,0.0,1.0,0.0,0.0
96,RACE,2020-03-23,04:14PM,Ferrari N.V.: periodic report on the buyback program,0.0,1.0,0.0,0.0
97,RACE,2020-03-19,09:45PM,World's governments draft manufacturers for virus treatment arsenal,0.0,1.0,0.0,0.0
98,RACE,2020-03-19,05:31PM,"Monaco Grand Prix canceled, and even Prince Albert has the coronavirus",0.0,0.769,0.231,0.4588
99,RACE,2020-03-19,04:19PM,World's governments draft manufacturers for virus treatment arsenal,0.0,1.0,0.0,0.0
